{
  "$schema": "https://json-schema.org/draft/2020-12/schema",
  "$id": "models.schema.json",
  "title": "Models",
  "description": "Individual pinball machine models (specific editions/variants of a title)",
  "type": "array",
  "items": {
    "type": "object",
    "properties": {
      "slug": { "type": "string", "pattern": "^[a-z0-9]+(?:-[a-z0-9]+)*$" },
      "name": { "type": "string", "minLength": 1 },
      "title": {
        "type": "string",
        "pattern": "^[a-z0-9]+(?:-[a-z0-9]+)*$",
        "description": "Slug of the title this model belongs to (references titles.json)"
      },
      "description": { "type": "string" },
      "display_type": {
        "type": "string",
        "description": "References a display_type value in display_types.json"
      },
      "variant_of": {
        "type": "string",
        "pattern": "^[a-z0-9]+(?:-[a-z0-9]+)*$",
        "description": "Slug of the base model if this is a variant/edition"
      },
      "is_conversion": {
        "type": "boolean",
        "description": "Whether this model is a conversion of another machine"
      },
      "converted_from": {
        "type": "string",
        "pattern": "^[a-z0-9]+(?:-[a-z0-9]+)*$",
        "description": "Slug of the model this was converted from"
      },
      "opdb_id": {
        "type": "string",
        "description": "Open Pinball Database identifier"
      },
      "ipdb_id": {
        "type": "integer",
        "description": "Internet Pinball Database identifier"
      }
    },
    "required": ["slug", "name", "title", "opdb_id"],
    "additionalProperties": false
  }
}
