[
  {
    "slug": "301bullseye",
    "name": "301/Bullseye",
    "title": "301bullseye",
    "is_conversion": true,
    "opdb_id": "G4kE2-MBRzN",
    "ipdb_id": 403
  },
  {
    "slug": "abba-collectors-edition",
    "name": "ABBA (Collector's Edition)",
    "title": "abba",
    "opdb_id": "Ge1py-MkPj1-AOppL"
  },
  {
    "slug": "abba-limited-edition",
    "name": "ABBA (Limited Edition)",
    "title": "abba",
    "variant_of": "abba-collectors-edition",
    "opdb_id": "Ge1py-MkPj1-A1XDN"
  },
  {
    "slug": "ac-dc-limited-edition",
    "name": "AC/DC (Limited Edition)",
    "title": "ac-dc",
    "variant_of": "ac-dc-premium",
    "opdb_id": "G43W4-MrRpw",
    "ipdb_id": 5777
  },
  {
    "slug": "ac-dc-premium",
    "name": "AC/DC (Premium)",
    "title": "ac-dc",
    "opdb_id": "G43W4-MXrPx",
    "ipdb_id": 5775
  },
  {
    "slug": "aerosmith-limited-edition",
    "name": "Aerosmith (Limited Edition)",
    "title": "aerosmith",
    "variant_of": "aerosmith-premium",
    "opdb_id": "Gr16e-M5Rbv",
    "ipdb_id": 6372
  },
  {
    "slug": "aerosmith-premium",
    "name": "Aerosmith (Premium)",
    "title": "aerosmith",
    "opdb_id": "Gr16e-Mq1k3",
    "ipdb_id": 6371
  },
  {
    "slug": "aerosmith-pro",
    "name": "Aerosmith (Pro)",
    "title": "aerosmith",
    "opdb_id": "Gr16e-MnKEX",
    "ipdb_id": 6370
  },
  {
    "slug": "alien-limited-edition",
    "name": "Alien (Limited Edition)",
    "title": "alien",
    "opdb_id": "G4PBO-MYep0"
  },
  {
    "slug": "amazon-hunt-iii",
    "name": "Amazon Hunt III",
    "title": "bone-busters-inc",
    "is_conversion": true,
    "converted_from": "bone-busters-inc",
    "opdb_id": "G5Lk0-MDeVZ",
    "ipdb_id": 4432
  },
  {
    "slug": "attila-the-hun",
    "name": "Attila the Hun",
    "title": "attila-the-hun",
    "opdb_id": "GrZxD-MLO4Y",
    "ipdb_id": 109
  },
  {
    "slug": "avatar-the-battle-for-pandora-collectors-edition",
    "name": "Avatar: The Battle for Pandora (Collector's Edition)",
    "title": "avatar-the-battle-for-pandora",
    "variant_of": "avatar-the-battle-for-pandora-limited-edition",
    "opdb_id": "GbPxB-MkPol-A9j2b"
  },
  {
    "slug": "avatar-the-battle-for-pandora-limited-edition",
    "name": "Avatar: The Battle for Pandora (Limited Edition)",
    "title": "avatar-the-battle-for-pandora",
    "opdb_id": "GbPxB-MkPol-A93vd"
  },
  {
    "slug": "avengers-infinity-quest-limited-edition",
    "name": "Avengers: Infinity Quest (Limited Edition)",
    "title": "avengers-infinity-quest",
    "variant_of": "avengers-infinity-quest-premium",
    "opdb_id": "Gj66P-MXr0E-ARkqN",
    "ipdb_id": 6756
  },
  {
    "slug": "avengers-infinity-quest-premium",
    "name": "Avengers: Infinity Quest (Premium)",
    "title": "avengers-infinity-quest",
    "opdb_id": "Gj66P-MXr0E-A1nx0",
    "ipdb_id": 6755
  },
  {
    "slug": "banzai-run",
    "name": "Banzai Run",
    "title": "banzai-run",
    "opdb_id": "GR9lZ-MkP2j",
    "ipdb_id": 175
  },
  {
    "slug": "barry-os-barbecue-challenge-collectors-edition",
    "name": "Barry O's Barbecue Challenge (Collector's Edition)",
    "title": "barry-os-barbeque-challenge",
    "opdb_id": "GK1Kv-ME0E0-A9PJq"
  },
  {
    "slug": "barry-os-barbecue-challenge-limited-edition",
    "name": "Barry O's Barbecue Challenge (Limited Edition)",
    "title": "barry-os-barbeque-challenge",
    "variant_of": "barry-os-barbecue-challenge-collectors-edition",
    "opdb_id": "GK1Kv-ME0E0-AO7ZV"
  },
  {
    "slug": "batman-66-limited-edition",
    "name": "Batman 66 (Limited Edition)",
    "title": "batman-66",
    "variant_of": "batman-66-premium",
    "opdb_id": "GRoz4-MrRPw",
    "ipdb_id": 6355
  },
  {
    "slug": "batman-66-premium",
    "name": "Batman 66 (Premium)",
    "title": "batman-66",
    "opdb_id": "GRoz4-MjBV6",
    "ipdb_id": 6354
  },
  {
    "slug": "batman-the-dark-knight",
    "name": "Batman: The Dark Knight",
    "title": "batman",
    "opdb_id": "G4yVw-M85j8",
    "ipdb_id": 5307
  },
  {
    "slug": "big-dryvers",
    "name": "Big Dryvers",
    "title": "space-orbit",
    "is_conversion": true,
    "converted_from": "space-orbit",
    "opdb_id": "G43WO-MJYYV",
    "ipdb_id": 4110
  },
  {
    "slug": "bird-watcher",
    "name": "Bird Watcher",
    "title": "bird-watcher",
    "is_conversion": true,
    "opdb_id": "GX2zO-M5Rr4"
  },
  {
    "slug": "black-hole",
    "name": "Black Hole",
    "title": "black-hole",
    "opdb_id": "G41yq-MQP65",
    "ipdb_id": 307
  },
  {
    "slug": "black-knight-limited-edition",
    "name": "Black Knight (Limited Edition)",
    "title": "black-knight",
    "opdb_id": "GrO7w-MDR9W",
    "ipdb_id": 3799
  },
  {
    "slug": "black-knight-sword-of-rage-limited-edition",
    "name": "Black Knight: Sword of Rage (Limited Edition)",
    "title": "black-knight-sword-of-rage",
    "variant_of": "black-knight-sword-of-rage-premium",
    "opdb_id": "GD7Ld-MBRP4-A1e4P",
    "ipdb_id": 6569
  },
  {
    "slug": "black-knight-sword-of-rage-premium",
    "name": "Black Knight: Sword of Rage (Premium)",
    "title": "black-knight-sword-of-rage",
    "opdb_id": "GD7Ld-MBRP4",
    "ipdb_id": 6568
  },
  {
    "slug": "blackwater-100",
    "name": "Blackwater 100",
    "title": "blackwater-100",
    "opdb_id": "G5K6X-MQjwK",
    "ipdb_id": 319
  },
  {
    "slug": "blood-bank-billiards",
    "name": "Blood Bank Billiards",
    "title": "blood-bank-billiards",
    "is_conversion": true,
    "opdb_id": "GPBzy-Mo1KX"
  },
  {
    "slug": "bobby-orrs-power-play",
    "name": "Bobby Orr's Power Play",
    "title": "bobby-orrs-power-play",
    "opdb_id": "G4en0-MJ5vB",
    "ipdb_id": 1858
  },
  {
    "slug": "bone-busters-inc",
    "name": "Bone Busters Inc.",
    "title": "bone-busters-inc",
    "opdb_id": "G5Lk0-MQjl3",
    "ipdb_id": 347
  },
  {
    "slug": "bride-of-pinbot",
    "name": "Bride of Pinbot",
    "title": "bride-of-pinbot",
    "opdb_id": "GRpee-MePdR",
    "ipdb_id": 1502
  },
  {
    "slug": "bride-of-pinbot-20",
    "name": "Bride of Pinbot 2.0",
    "title": "bride-of-pinbot",
    "is_conversion": true,
    "converted_from": "bride-of-pinbot",
    "opdb_id": "GRpee-MJkyr",
    "ipdb_id": 6319
  },
  {
    "slug": "buck-rogers",
    "name": "Buck Rogers",
    "title": "tiger",
    "is_conversion": true,
    "converted_from": "tiger",
    "opdb_id": "GRw8o-MDxjq",
    "ipdb_id": 4999
  },
  {
    "slug": "cactus-canyon",
    "name": "Cactus Canyon",
    "title": "cactus-canyon-remake",
    "opdb_id": "G4835-Mb5eO",
    "ipdb_id": 4445
  },
  {
    "slug": "cactus-canyon-continued",
    "name": "Cactus Canyon Continued",
    "title": "cactus-canyon-remake",
    "is_conversion": true,
    "converted_from": "cactus-canyon",
    "opdb_id": "G4835-M2YEn"
  },
  {
    "slug": "cactus-canyon-lyman-upgrade",
    "name": "Cactus Canyon (Lyman Upgrade)",
    "title": "cactus-canyon-remake",
    "variant_of": "cactus-canyon-remake-special-edition",
    "is_conversion": true,
    "converted_from": "cactus-canyon-remake-special-edition",
    "opdb_id": "G4835-M2YPK-ARkb7"
  },
  {
    "slug": "cactus-canyon-remake-limited-edition",
    "name": "Cactus Canyon (Remake Limited Edition)",
    "title": "cactus-canyon-remake",
    "variant_of": "cactus-canyon-remake-special-edition",
    "remake_of": "cactus-canyon",
    "opdb_id": "G4835-M2YPK-A9ylv"
  },
  {
    "slug": "cactus-canyon-remake-special-edition",
    "name": "Cactus Canyon (Remake Special Edition)",
    "title": "cactus-canyon-remake",
    "remake_of": "cactus-canyon",
    "opdb_id": "G4835-M2YPK-AR5ln"
  },
  {
    "slug": "centaur",
    "name": "Centaur",
    "title": "centaur",
    "opdb_id": "GrX7q-MLWkn",
    "ipdb_id": 476
  },
  {
    "slug": "central-park",
    "name": "Central Park",
    "title": "central-park",
    "opdb_id": "GRpYQ-MRj0O",
    "ipdb_id": 481
  },
  {
    "slug": "challenger",
    "name": "Challenger",
    "title": "eight-ball",
    "is_conversion": true,
    "converted_from": "eight-ball",
    "opdb_id": "GrN7J-MDlYZ",
    "ipdb_id": 3922
  },
  {
    "slug": "challenger-ii",
    "name": "Challenger II",
    "title": "evel-knievel",
    "is_conversion": true,
    "converted_from": "evel-knievel",
    "opdb_id": "G59wx-MLnZ3-A1lJd",
    "ipdb_id": 4987
  },
  {
    "slug": "challenger-iii",
    "name": "Challenger III",
    "title": "bobby-orrs-power-play",
    "is_conversion": true,
    "converted_from": "bobby-orrs-power-play",
    "opdb_id": "G4en0-MJ5vB-ARevr",
    "ipdb_id": 4986
  },
  {
    "slug": "challenger-iv",
    "name": "Challenger IV",
    "title": "strikes-and-spares",
    "is_conversion": true,
    "converted_from": "strikes-and-spares",
    "opdb_id": "GrleW-MYeod-AO3dY",
    "ipdb_id": 4985
  },
  {
    "slug": "challenger-v",
    "name": "Challenger V",
    "title": "star-trek-bally",
    "is_conversion": true,
    "converted_from": "star-trek",
    "opdb_id": "GRVnd-MQZzx-AOjJv",
    "ipdb_id": 4984
  },
  {
    "slug": "checkpoint",
    "name": "Checkpoint",
    "title": "checkpoint",
    "opdb_id": "G4Jdp-MJNrr",
    "ipdb_id": 498
  },
  {
    "slug": "cirqus-voltaire",
    "name": "Cirqus Voltaire",
    "title": "cirqus-voltaire",
    "opdb_id": "GRVjJ-MLq7W",
    "ipdb_id": 4059
  },
  {
    "slug": "city-ship",
    "name": "City Ship",
    "title": "super-spin",
    "is_conversion": true,
    "converted_from": "super-spin",
    "opdb_id": "G4qzZ-MQpoP-A9pdL",
    "ipdb_id": 5130
  },
  {
    "slug": "cleopatra",
    "name": "Cleopatra",
    "title": "cleopatra",
    "opdb_id": "GrknN-MQrdv",
    "ipdb_id": 532
  },
  {
    "slug": "cleopatra-play-pool",
    "name": "Cleopatra",
    "title": "play-pool",
    "is_conversion": true,
    "converted_from": "play-pool",
    "opdb_id": "G5n1Q-MQPRP",
    "ipdb_id": 4111
  },
  {
    "slug": "comet",
    "name": "Comet",
    "title": "comet",
    "opdb_id": "Gryd3-MLqjd",
    "ipdb_id": 548
  },
  {
    "slug": "coney-island",
    "name": "Coney Island",
    "title": "lady-robin-hood",
    "is_conversion": true,